Id,Category,Tweet
641576493659889000,positive,i wanna party with justin and get really drunk then fuck like theres no tomorrow
623378299838816000,positive,I wanna see Ted 2 again for the 3rd time that shit is so god damn funny
635490046934560000,positive,I wanna see the old Tiger Woods today... Wearing his red and having fun on a Sunday! Now that would be somethin..
638032354171207000,positive,I want a slow Sunday consisting of snuggles and cuddles and Jurassic Park.
630198560563200000,positive,I want be here most of tomorrow so don't expect me to retweet low res close up pics of snoop dogg
638350720329232000,positive,"I want January, I want Teen Wolf."
623200363387224000,positive,I want Magic Mike XXL!!  C'mon? ;)  #hoorayformonday #workwork #nachos #lavinia #novaturient
641425193190100000,positive,I want Taylor swift tickets for Minnesota this sunday!! :(
641575077713195000,positive,I want to have a Star Wars party for my 21st
630768746748055000,positive,I want to play Rock Band 4 in anticipation of Jurassic World on Friday.
634300661174173000,positive,I want to see Valentine's Day boxers that say 'may contain traces of nuts'
629085690031153000,positive,I want to stay up to see what happens at metlife tonight but I have to wake up so early for class tomorrow ugh
621501007856578000,positive,I want to thank so much my best friend treating me out to Pizza Hut for dinner and see Ted 2 for my 30th birthday.
641462074338623000,positive,I was 8 turning 9 in the 4th grade when I started to support Justin. Now Im a freshman in highschool still loving him to this day Time flies
641257894600577000,positive,"I was about to say, UK better not get Star Wars a week early. But they aren't. 17th is thursday. We get mad shows on Thursday's now anyways!"
637836315984293000,positive,I was certainly not expecting @JColeNC to bring @Drake and Jay-Z to the Ville.  I may have dropped a tear or two.  Greatest show ever!
641374584860725000,positive,"i went through my old iPod nano and I still listen to the same music I did in 5th grade..chili peppers, green day, the killers, blink omfg"
635327668737589000,positive,I will go out and say it now! Tiger Woods will put together a solid 65 tomorrow and win!! You heard it from me first!!
638222868904456000,positive,"I will undergo my medical for Juventus tomorrow, I can play trequartista and CAM, both at the same time."
628944539429011000,positive,I wish I was going to MetLife tonight but I'm not upset about it cause I'm going to Baltimore on Saturday....
641627938186743000,positive,i work till 3pm . yay lol cant wait till thursday and get paid . need to get back on xbox to lpay with @projectkaboom and @xSidShow
641436078201786000,positive,I would do anything to see taylor swift in concert on the 18th
626351624307519000,positive,"I would like to see docs on British Bulldog, Ric Flair's 16 title wins &amp; the Royal Rumble match. #DocumentThisWWE https://t.co/uKWo3wmtto"
636025757672820000,positive,I would love to have cavani man. He's over shawdowed and played 2nd fiddle to Zlatan he would shine at arsenal
626678338862497000,positive,I'll be joining @JustinTrudeau in Vancouver's Pride Parade Sunday. Walk with us! http://t.co/ynnw2jL4ax #burnaby #vanpride #lpc
634372935541592000,positive,I'll be live streaming the sad Giants fans via @AppMeerkat this Saturday night at MetLife after @BBortles5 beats the Giants again. #JAXvsNYG
630600913141436000,positive,"I'll never forget Valentine's Day back in 8th grade, like seriously I got the cutest present ever! No one will ever be compared to you"
631495757133160000,positive,I'm a little too excited about this Kurt Cobain albums m coming out in November!
631693323049177000,positive,I'm a PDF convert. I shall seek the almighty Oracle for guidance. @michaelshermer  https://t.co/7D2yYGH6o4
641639484283572000,positive,I'm actually about to try to convince my mom to let me see Justin in New York tomorrow
639406022113628000,positive,I'm actually so excited for tomorrow just so I can know who's coming from the teen wolf cast
639002205358415000,positive,I'm almost at the end of the 3rd season of Teen Wolf and I'm already in tears bc I know what's coming up
641643603400364000,positive,I'm eligible for an upgrade next Monday. Hopefully the new iPhone drops next Friday so I can go straight to Verizon after work.
636484412654268000,positive,I'm getting the gut feeling that Sting will win the WWE title belt(which'll drive the wrestling podcasters insane) https://t.co/KozEyUa5Mn
641260282375868000,positive,I'm going to be in the same room as Taylor Swift tomorrow.
638858045322338000,positive,I'm going to play Minecraft tomorrow on http://t.co/Xv7AlrYDDb around 4:00 I'll be in survival at my plot my user name is ssmississippi
625322593160175000,positive,I'm going to see magic Mike xxl (I think that's what it's called) this Tuesday with two friends (it's a movie with Channing Tatum &lt;3)
628391226128093000,positive,I'm going to see Snoop Dogg (aka DJ Snoopadelic) dj tomorrow at Sankeys and that's all that matters
640873454422593000,positive,I'm going to Target today solely to look at Star Wars toys. I missed Force Friday due to filming.
641145916955561000,positive,I'm going to the Nike employee store tomorrow and I'm so fucking excited
621771848150335000,positive,i'm going to watch ted 2 on saturday
620820906164813000,positive,I'm gonna go see Ted 2 tomorrow at the theater down the block. 5.75 matinee I can't be mad
634527144249528000,positive,I'm gonna watch Jurassic World again for the 10th time
640918530041507000,positive,I'm gunna look exactly like madonna tomorrow at the fashion show
639474041305309000,positive,I'm in Nike shorts and a tank and some bitch just asked if I work at pac sun....bye
639992058132852000,positive,I'm like ready for Monday just so I can watch Teen Wolf.
641436936536760000,positive,I'm man enough to admit that I proudly couldn't handle Serena's back shot. Babygirl may have the skrongest thigh/a$$ muscles in the world
634939959879688000,positive,I'm most def. going to the Snoop Dogg (Lion)  concert in October!!!!!!!!!!!
636586322803748000,positive,I'm not excited because a Minecraft game is coming to #WiiU. It's because it's 3rd party support and I'd love to see other TT games coming.
638108691653246000,positive,"I'm not huge fan of Tom Cruise but much like the last movie I saw him in, Edge of Tomorrow, #MissionImpossibleRogueNation was really good."
641186129459478000,positive,I'm not taking my iPod to school tomorrow because I want to have a battery when I go to my concert
635624424004186000,positive,I'm on the floor eating left over spaghetti for breakfast and watching Seinfeld while the baby naps. Must be Monday #maternityleave
641354833195220000,positive,I'm proud of what my Xbox live Gamertag is going to be tomorrow. Me and my friends just thought of it.
630956549771501000,positive,I'm ready to sponsor! I want SIX LEXUS earners by December! Will this be you? Wouldn't it be awesome to have one... http://t.co/3kYnX3evGQ
641456878019448000,positive,I'm really bored guys idk if you can tell I'm gonna have a Netflix marathon tomorrow suggest things I could watch
639482744179822000,positive,I'm rewatching the Cheetos and Water part from Magic Mike XXL for the 3rd time lol
641089812133363000,positive,I'm serious if anyone is selling cheap tickets for Taylor swift on Wednesday let me know idc if it's nosebleeds
640365443610374000,positive,I'm sitting at home on a Saturday night watching Jurassic Park and I'm totally content with it.
641512927225208000,positive,I'm so excited for the new iphone release tomorrow yas.
641655398836097000,positive,"I'm so excited to see the new iPhone release, even though it may be following a trend xD"
640304371658526000,positive,I'm taking my grandma to see Jurassic World on Monday since she pussed out on seeing it any time before
623975982181945000,positive,I'm taking my women's networking group to see Magic Mike XXL tomorrow and many of them are over 60 so this is going to be a good time.
639301319396712000,positive,I'm the same height as Snoop Dogg wowie  smoke marijune erry sunday
640215120191164000,positive,I'm trying to decide what I want my son to be 4 Halloween 1.Donald Trump  2.Barack Obama or 3rd Michael Jackson he could pull off all three
625888552216195000,positive,I'm watching Ted 2 for the 3rd time in a row and I'm cryiiiing of how funny it is
641447452105682000,positive,I'm watching Teen Wolf season 2 tomorrow it's been decided
640198745456558000,positive,I've always related so much to Ender and Valentine all through my life.  I remember writing to OSC in 4th grade about it.
636202034392264000,positive,I've been using Tom's Natural toothpaste and just read an article that March Against Monsanto saying that this... http://t.co/dcudFHc9rw
640034791585382000,positive,I've got a picture to show Taylor tomorrow and she's probably not gonna like it because she's a hater. Adidas &gt; Nike
635999529347649000,positive,I've had my new Windows 10 laptop for 1 week. So far I'm loving the laptop and the OS. Only a couple of minor bugs with 3rd party apps.
637324096112488000,positive,I've listened to the KSU Clarinet Choir recording of the Jurassic Park theme 11 times today. Currently listening to it for a 12th time.
634329596184301000,positive,"Ich habe ein @YouTube-Video positiv bewertet: http://t.co/4njhci2kuC Sting saves Randy Orton from the Authority: WWE Raw, March 16,"
641408178207395000,positive,"ICYMI the AFHS Labor Day Sale has been EXTENDED, but don't wait it absolutely ends MONDAY! #ThisIsHome http://t.co/L3Qu2Tfkkm"
639088763898068000,positive,"If @MsCharlotteWWE defeats Nikki Bella at #nightofchampions, it Should be similar to how Ric Flair beat Dusty Rhodes to win his 1st title"
640168030320885000,positive,"If Airbnb is good enough for Mariah Carey, It may be good enough for you.  $25 Travel Coupon http://t.co/f3B3bdlvCm http://t.co/AydJRfN1ys"
624472536579993000,positive,If Alexandre Lacazette does move to PSG does that mean that a Zlatan transfer may be in the making? #Ibrahimovic #soccer #futbol
641581548349865000,positive,"If Apple is upgrading the camera on the iPhone 6s models, I seriously may upgrade...&amp; my phone isn't even 1yr old yet! #photographyproblems."
620657248138862000,positive,If Barack or Michelle Obama walk the runway during Style tonight or tomorrow life will be complete. That is all.
624937993502109000,positive,If I get to watch Zlatan play today against Chelsea I may just lose my mind
641531450815217000,positive,"If im in the club, i'll put my phone away &amp; have fun, dance like mad with justin. Unfortunately im not legal yet lol https://t.co/1yxSPzA4Wf"
641065228789153000,positive,"If Joe Biden runs for president, he can count on the kind of union workers he spoke to Monday http://t.co/Bm5ATCrIcl"
638292674169147000,positive,"If Kanye became President, folk that wrote off the masonic/illuminati symbols in he and Jay-Z's music/vids as meaningless, may think again!"
624661429245898000,positive,"If Ric Flair replaces Hogan on tough enough, I may actually start watching it @WWE"
639840067171786000,positive,"If Rick Perry does not win the election, he has lost nothing as he is a strong family man, and a true Christian. https://t.co/jfo2HrUnv8"
632589431040528000,positive,If they made jurassic park today jesse Eisenberg would probably play dr Malcolm and I think he'd do well. Have a good Saturday
635025649351192000,positive,"If we go to London on Valentine's Day, I will attend Bend It Like Beckham on the 12th or 13th. I WILL BE THERE"
637275722436886000,positive,If you are curious about my wild Friday nights: I promised Liam I would play Minecraft &amp; Kennedy requested burritos for dinner.
636356188666368000,positive,"If you don't take the risk, you may not experience the adventure ---Mariah Carey"
641600180521832000,positive,"If you had Castle Crashers on Xbox 360, it will be free today for Xbox One owners. This is incredible. https://t.co/xyVWQlHK6O"
639401660595466000,positive,If you like old school Madonna you may like this  http://t.co/op0LV6gnfk http://t.co/C7wzkq2TkO
641379710006611000,positive,"If you missed out on Pope tix for Independence Hall,just annnounced 2 more tix avails online 4&amp;8pm Wed @fox29philly http://t.co/FOYiCO4hQg"
641652444536143000,positive,"If you're an iPhone user like myself, new phone and more to be revealed in the next 20 minutes! Watch it live here http://t.co/FzBHq5Xx9I"
637000642347823000,positive,"If you're coming to Snoop Dogg this Saturday, please screenshot your receipt. If it's purchased today, YOU GET... http://t.co/ff9kXztcSQ"
641573894663614000,positive,"If you're in Kerry tomorrow evening and looking for some fun, come on down to St John's in Listowel.   Love,... http://t.co/6r1hQ23vwi"
628858362357116000,positive,if your going to MetLife tomorrow.. HAVE FUN
641560327159726000,positive,If your pupils can use an iPad better than you can then this course may well be ideal for you - http://t.co/8innWbrMqY
638173354420125000,positive,ill be watching that in january right along with teen wolf
637985125767217000,positive,Im going to finish now the 2nd season of teen wolf
638012791039766000,positive,im going to marathon all of the episodes in the 5th season of teen wolf that i havent seen yet bc i deserve that dammit
641411940154261000,positive,Im hyperventilating about tomorrow with Justin and ellen i dont think Im gonna be able to sleep tomorrow i think it gonna be the best bday
641115158887051000,positive,im just excited to see messi tomorrow
640743490196893000,positive,Im mind blown after watching Magic Mike XXL for the 1st time
628228830134669000,positive,Imagine going home before Sunday and missing Snoop Dogg hahahaha
640327401524842000,positive,Imagine having a 20th of Messi's ability. You'd be the best in your team
629052165177384000,positive,Imagine if Ether had dropped in the social media age. We may not have the same respect we do for Jay-z today.
634258710970413000,positive,"IMHO, it may not be the NSA we should worry about. ""Windows 10 is the end of cloud-free computing"" http://t.co/bri1SI8aEj via @verge"
640547904004816000,positive,"Immensely enjoyable TV Song show ""Indian Idol Jr"" comes to a close today.Well done Sony, may the best kid win.All the finalists were tops."
626852305539846000,positive,"Impromptu day off tomorrow for an extra long weekend, so I'm treating myself to a pedicure and feeling like I'm in a Seinfeld episode."
639611172698787000,positive,In 14 years Gov. Rick Perry's conservative principles madeTX the 12th largest Global economy https://t.co/AmrzDttmq0 http://t.co/JV95TgpdQa
641075551860604000,positive,"in 6th grade there was this boy that liked me, but I hated him, and for Valentine's Day he put a card in my locker w. $5 in it... goals."
626510385584177000,positive,"In case you missed it, or want to look for yourself, last Sunday's 21st annual #LdnOnt Pride Parade airs at 8 p.m. tonight on Rogers TV."
637222599555162000,positive,"In June she holidayed in Europe, meeting up with ex husband James Packer and his new partner Mariah Carey - and now Jodhi Meares is"
625394044512956000,positive,"In May I sent a Children at Nature Play sign to First Lady Michelle Obama. Today, I received a thank you note... http://t.co/RzKpcRd6CA"
638490844954251000,positive,"In no particular order, the top three Tom Cruise films are: Magnolia, Edge of Tomorrow and all the Mission Impossibles."
641444538431766000,positive,"In the 27th Williams vs. Williams match, Serena saved her best for last: http://t.co/y2l32heh0Y http://t.co/mG6FnRPgXZ"
635885736412246000,positive,"In the crib singing Mariah Carey as usual and everyone's tight and idc, I got the Monday blues"
641584856976203000,positive,"In Wednesday's #FirstFT - long reign the Queen, iPhone unveiling and more. Sign up at http://t.co/gDolGlrSv5 http://t.co/SIBupoDQu4"
636014397698232000,positive,"Including his TNA title wins, Sting is a 14-time World Champion. Beating Seth would tie him with Cena for 2nd of all time. @wwe #raw"
640258412828336000,positive,"Iniesta is the 3rd best after Messi and Ronaldo, no one comes close, not Neymar not Hazard #spain"
640639272719122000,positive,Initial pass to Messi zipped in. Only he could tame the ball &amp; pass to Xavi 1st time. Minimal backlift from another planet. @Phase_in_out
639005537942700000,positive,Intel hopes its 6th gen chip range for Windows 10 will be a tablet killer: The company is hoping that the chip... http://t.co/vIWc0lzlAZ
634448060362309000,positive,Intel shows off waking Windows 10 machine with voice command: Intel Corporation (NASDAQ:INTC) may have sidelin... http://t.co/bng3Znwwce
641431992794386000,positive,Interested to see what kind of ratings the U.S. Open final gets on Saturday with Serena presumably going for history up against CFB.
641462066197348000,positive,Interesting about this. Trump keeps saying Cruz is joining him. I think Cruz started this and asked Trump to join. https://t.co/JVRVxUjuwp
639095227236663000,positive,"Interesting, Apple is allowing Windows 10 users to watch the next keynote stream with Edge http://t.co/bEbt1z0hfh http://t.co/mKtUerjoLp"
641602592401821000,positive,"iPad Pro, Apple TV expected to take center stage Wednesday: It's that time of the year. For five years, Apple ... http://t.co/eHpn3KzylM"
641556474221625000,positive,"iPhone 6s: Everything you need to know!: Apple's event of the year, which is being held on September 9, has ma... http://t.co/LrIJS2reRb"
641496447460986000,positive,"iPhone event recap video tonight, then Transloader for Mac app review on Saturday. Cool content coming up! :)"
640705457070456000,positive,Is anyone trying to go with me on September 28th to see Madonna?
628345809197793000,positive,"Is drake man enoff 2 diss snoop Dogg?, I bet he will be a dead man by sun down!!!! Uncle snoopy takes no shit"
625046763297198000,positive,Is Michelle Obama and the sytycd crew dancing at the White House today cuz I may have to join
641618508028248000,positive,Is that I am very excited to share on Instagram brings their app to iPad and redesigns the iWatch in November.
629186753157595000,positive,Is the future finally here? Lexus may have the hoverboard of your dreams ? video  http://t.co/hJf3Z1ou97
637343421527642000,positive,"Is this the ultimate guide to detailing your car? It may very well be, courtesy of Lexus: http://t.co/xaBpkq4nkI http://t.co/jv9DFTvvwD"
641491701429760000,positive,"Is tomorrow's new Apple TV really a games console, and does it involve Nintendo?: And if there's one thing tha... http://t.co/lCd50kc2vc"
636947940968300000,positive,It has been almost 21 years since Kurt Cobain the lead of Nirvana died.I find it truely amazing that his legacy still lives on. May he R.I.P
641649622516043000,positive,"It may be past Labor Day, but our new participant t-shirt celebrates an endless summer here in the Ocean State.... http://t.co/e4xuK2sEiA"
640723876402434000,positive,"It may have been our trip to Disney and the release of all the new #starwars stuff, but Jose and I are totally in a Star Wars mood"
637517022146990000,positive,It started when zion turned to me and stated that snoop Dogg just may be the smoothest and i concurred
641633293729943000,positive,It was fun to see the excitement on the 6th graders' faces. And some of them seem to be iPad pros already! https://t.co/YnZtTTyg4W
641296016788996000,positive,It would be poetic if Nintendo became a Sony 2nd Party Developer. It would also make choosing consoles every generation very easy
641415924042481000,positive,It's about to get real. TAYLOR SWIFT!  https://t.co/0IsESUe9oD
629094944481935000,positive,"it's August 5 in MetLife stadium, stay safe Harry, thinking about you the whole night #HarryBeCareful"
640615130284228000,positive,"It's been a long wait, but this is the last Sunday without football until Valentine's Day! We're in it for the long haul #Football #NFL"
639750938274721000,positive,"It's Friday again.,TGIF... make gud use of it, don't waste it like d last Friday..#time wasted can not be regained."
639694851542532000,positive,It's Friday and the end of a short week...Result!! Lets celebrate with @jtimberlake and Madonna after 8am this morning! Dave &amp; Heidi x
639900354386206000,positive,It's Friday and today we have a Fashion Bomber and Bombshell of the Day combo! Thoughts on Morenike and Valentine... http://t.co/DFF6hZGyeB
639878819982217000,positive,it's friday so give me two claps and a Ric Flair!
626905665563414000,positive,"It's going to be a BIG weekend! Pride parade, official Patio Day &amp; a holiday Monday. Check out out hours--&gt; http://t.co/SuO5nrX9Js"
641655288530010000,positive,It's nice that if Trump doesn't work out the GOP can fall back on Carson. https://t.co/Gn4jUdKT6e
641171546581651000,positive,"It's official, Star Wars to be released in the UK on the 17th of December. http://t.co/bFST0e1vBs"
638004741243543000,positive,It's Sunday and its a TOP game in the Serie A with both #Pjanic and #Dzeko starting against Juventus. I love it. http://t.co/rCQPcpvrxh
635587510505197000,positive,"It's Sunday, so you know what that means Venice Beach....Peace Frog live music at Venice Bistro!"
639804828739346000,positive,It's the first Football Friday of the year. That means two things: no more previews and the march to MetLife is on! http://t.co/2diKeUVN3O
635509856821096000,positive,It's weird seeing Tiger Woods being able to wear red again. Not too often that he makes it to Sunday now a days.
641628508532396000,positive,it's your last chance to take advantage of Gazelle's best price guarantee on iPhone trade-ins... http://t.co/WLycePxNjc
640146715182436000,positive,"Its #FreddieMercury's 69th Birthday! Many of you may have seen this, here's a rare pic of him with Michael Jackson! http://t.co/RY5GliAqjq"
634890543349108000,positive,Its friday i just might hit venice beach #venicebeach
641623122651820000,positive,ive been to the library twice and both times ive sat in swanky chairs watching netflix #lit #collegegoals #woo
636416946523672000,positive,Jack Johnson from Jack and Jack if you see this please go to venice beach tomorrow morning or Santa Monica tomorrow night ok thanks :)
633380644001742000,positive,James Bland I'll take this for our 21st anniversary and valentine's day.....but pink roses please http://t.co/yXKAqBpbM4
640105090972536000,positive,James Rodriguez is fast closing in on the 2nd grade of best footballers (those immediately after Messi and Ronaldo)...
641369063889879000,positive,Jamming to Taylor Swift on the Tuesday after Labor day. @taylorswift13 makes any day a good day
633071290581172000,positive,Jan runs into Michelle Obama on her way to a charity event. Storm clouds begin to brew over the women as they battle for psychic control.
639608392474988000,positive,"Javier Saviola: ""I'd be delighted if Messi won his 5th Ballon d'Or because of the quality of his football and because of our friendship."""
638594008437104000,positive,"Jay Z 'pays tribute to Michael Jackson as he joins Instagram' with touching photo, it may be his last http://t.co/dQHJT59Ciy"
639372766198779000,positive,"Jay Z apparently joined Instagram on Saturday and posted a photo montage of himself with Michael Jackson, who would have been 57 years old."
638061181823922000,positive,Jay Z joins Instagram with nostalgic tribute to Michael Jackson: Jay Z apparently joined Instagram on Saturday and.. http://t.co/Qj9I4eCvXy
632269019446276000,positive,"Jay-Z and Beyonce came to Taylor's 25th but not Kim and Kanye's wedding. Imma let Taylor finish, but she had the best birthday of all time."
638930270511583000,positive,Jay-Z sat in that Interview like a God showing that he was truly ahead of his time while the other niggas flirting with Foxy Brown
636583750915215000,positive,Jeb Bush says he cut off funding to Planned Parenthood as governor | PolitiFact Florida http://t.co/P7CyCOHBhu
633468622363455000,positive,"Joakim Noah may have grown up in France, but he was still a big fan of Dr. Dre and Snoop Dogg http://t.co/tJyY82cl5A http://t.co/ZN4qmMRDyi"
639859033969659000,positive,Joe Biden and Debbie Wasserman Schultz gush with praise for each other - Sun Sentinel http://t.co/qiOe4oLag2
639843705973698000,positive,Joe Biden came to Miami on Wednesday and sounded at times like a politician with another campaign in him http://t.co/FfKJOjkAWD
641219216021016000,positive,Joe Biden may just be the answer to stoping the family entitlement in U.S. politics if Martin O'Malley doesn't succeed. Run Joe Run!
626971786249412000,positive,Joe Cronin Calling the Action Friday Night - The NATURE BOY Ric Flair Is in the House  @TopRopePro   @WWENXT @NatbyNature  @KiddWWE
636006516861083000,positive,John Stewart's 2nd Act! Going toe-to-toe with John Cena &amp; Ric Flair in the ring! https://t.co/b7WtmPdwHg
633391209415843000,positive,Join me in supporting gender equality at the GoTopless Pride parade this Sunday in Venice Beach! http://t.co/Jyc6wx6L8U
639046352026992000,positive,Join me tomorrow night (Thurs.) at Lexus of Santa Fe at 6 PM to find out how you too can own or lease a FREE... http://t.co/M1lbZJnyRW
641271370664443000,positive,"Join the Moral March in Washington, DC on September 24: On September 24, Pope Francis will address Congress on... http://t.co/QfyWQ5ys2X"
641323950056841000,positive,Join the MOVable Challenge! Get your MOVband at Spirit Fest tomorrow or Thursday and move one step closer to an iPad! http://t.co/QEv1anI83s
627607112269459000,positive,"Join us at our pride picnic this Mon Aug 3rd at 2pm, the day after Pride Parade :) http://t.co/A4GIGeBhy4  #Vancouver http://t.co/YAxegHHo6b"
